id;question;extra;suspicious_status;suspicious_note
Who has been waiting the longest? – [They:t.Personal,p3,f.Formal] have.; Кто ждал дольше всех? – Они ждали.;0;
Who has been waiting the longest? – [Them:t.Personal,p3,f.Colloquial].; Кто ждал дольше всех? – Они.;0;
Who will be speaking at the event? – [I:t.Personal,s1,f.Formal] will be.; Кто будет выступать на мероприятии? – Я буду.;0;
Who will be speaking at the event? – [Me:t.Personal,s1,f.Colloquial].; Кто будет выступать на мероприятии? – Я.;0;
Who should have called earlier? – [He:t.Personal,s3,f.Formal] should have.; Кто должен был позвонить раньше? – Он должен был.;0;
Who should have called earlier? – [Him:t.Personal,s3,f.Colloquial].; Кто должен был позвонить раньше? – Он.;0;
Who might have left the door open? – [She:t.Personal,s3,f.Formal] might have.; Кто мог оставить дверь открытой? – Она могла.;0;
Who might have left the door open? – [Her:t.Personal,s3,f.Colloquial].; Кто мог оставить дверь открытой? – Она.;0;
Who had been working on this before the change? – [We:t.Personal,p1,f.Formal] had been.; Кто работал над этим до изменений? – Мы работали.;0;
Who had been working on this before the change? – [Us:t.Personal,p1,f.Colloquial].; Кто работал над этим до изменений? – Мы.;0;

# personal-subj.nuances(6 - singular they)
Nobody knows what [they:t.Personal] are doing all the time.; Никто не знает, что делает всё время.; 0;  
Someone said [they:t.Personal] would be here by noon.; Кто-то сказал, что они будут здесь к полудню.; 0;  
If anyone arrives early, [they:t.Personal] can wait in the lobby.; Если кто-то придёт рано, они могут подождать в холле.; 0;  
Every employee should ensure [they:t.Personal] meet the deadline.; Каждый сотрудник должен убедиться, что они уложились в срок.; 0;  

# personal-subj.noun2pronoun
John is reading a book → [He:t.Personal] is reading a book; Он читает книгу.;0;
The cat is sleeping on the couch → [It:t.Personal] is sleeping on the couch; Он/Она спит на диване.;0;
My friends and I are going to the park → [We:t.Personal] are going to the park; Мы идём в парк.;0;
Sarah and Tom love pizza → [They:t.Personal] love pizza; Они любят пиццу.;0;
The teacher is explaining the lesson → [He/She:t.Personal] is explaining the lesson; Он/Она объясняет урок.;0;
This car is very fast → [It:t.Personal] is very fast; Она очень быстрая.;0;
Mike and I work together → [We:t.Personal] work together; Мы работаем вместе.;0;
Your brother likes football → [He:t.Personal] likes football; Он любит футбол.;0;
The flowers are blooming → [They:t.Personal] are blooming; Они цветут.;0;
The book is on the table → [It:t.Personal] is on the table; Она на столе.;0;

80;He saw [me:Type.personal-obj,s1].;Он видел меня.;0;
81;They invited [me:Type.personal-obj,s1] to the party.;Они пригласили меня на вечеринку.;0;
82;She found [me:Type.personal-obj,s1] in the garden.;Она нашла меня в саду.;0;
83;The teacher praised [me:Type.personal-obj,s1].;Учитель похвалил меня.;0;
84;They accused [me:Type.personal-obj,s1] of cheating.;Они обвинили меня в обмане.;0;
85;She gave [me:Type.personal-obj,s1] a gift.;Она дала мне подарок.;0;
86;They sent [me:Type.personal-obj,s1] a letter.;Они отправили мне письмо.;0;
87;Can you pass [me:Type.personal-obj,s1] the salt?;Можешь передать мне соль?;0;
88;The book belongs to [me:Type.personal-obj,s1].;Эта книга принадлежит мне.;0;
89;Tell [me:Type.personal-obj,s1] the truth.;Скажи мне правду.;0;
90;Please help [me:Type.personal-obj,s1].;Пожалуйста, помоги мне.;0;
91;They saw [me:Type.personal-obj,s1] yesterday.;Они видели меня вчера.;0;
92;He invited [me:Type.personal-obj,s1] to dinner.;Он пригласил меня на ужин.;0;
93;She called [me:Type.personal-obj,s1] last night.;Она звонила мне вчера вечером.;0;
94;The dog followed [me:Type.personal-obj,s1] home.;Собака пошла за мной домой.;0;
95;She is happy with [me:Type.personal-obj,s1].;Она счастлива со мной.;0;
96;They worked with [me:Type.personal-obj,s1] on the project.;Они работали со мной над проектом.;0;
97;The teacher was impressed by [me:Type.personal-obj,s1].;Учитель был впечатлён мной.;0;
98;He argued with [me:Type.personal-obj,s1] about politics.;Он спорил со мной о политике.;0;
99;They danced with [me:Type.personal-obj,s1] at the party.;Они танцевали со мной на вечеринке.;0;
100;She always talks about [me:Type.personal-obj,s1].;Она всегда говорит обо мне.;0;
101;What do you think about [me:Type.personal-obj,s1]?;Что ты думаешь обо мне?;0;
102;They wrote a story about [me:Type.personal-obj,s1].;Они написали историю обо мне.;0;
103;The article is about [me:Type.personal-obj,s1].;Эта статья обо мне.;0;
104;Don’t worry about [me:Type.personal-obj,s1].;Не переживай обо мне.;0;
105;I saw [you:Type.personal-obj,s2].;Я видел тебя вчера.;0;
106;They invited [you:Type.personal-obj,p2] to the meeting.;Они пригласили вас на встречу.;0;
107;She remembered [you:Type.personal-obj,s2] from school.;Она вспомнила тебя из школы.;0;
108;They accused [you:Type.personal-obj,s2] of lying.;Они обвинили тебя во лжи.;0;
109;I need to talk to [you:Type.personal-obj,s2].;Мне нужно поговорить с тобой.;0;
110;She gave [you:Type.personal-obj,s2] a gift.;Она дала тебе подарок.;0;
111;They sent [you:Type.personal-obj,p2] a letter.;Они отправили вам письмо.;0;
112;Can I show [you:Type.personal-obj,s2] something?;Могу показать тебе что-то?;0;
113;The book belongs to [you:Type.personal-obj,p2].;Эта книга принадлежит вам.;0;
114;Tell [you:Type.personal-obj,s2] the truth.;Скажи тебе правду.;0;
115;Please help [you:Type.personal-obj,s2] with the project.;Пожалуйста, помоги тебе с проектом.;0;
116;They saw [you:Type.personal-obj,p2] at the party.;Они видели вас на вечеринке.;0;
117;She called [you:Type.personal-obj,s2] last night.;Она звонила тебе вчера вечером.;0;
118;He invited [you:Type.personal-obj,s2] to dinner.;Он пригласил тебя на ужин.;0;
119;I trust [you:Type.personal-obj,s2].;Я доверяю тебе.;0;
120;They worked with [you:Type.personal-obj,s2] on the project.;Они работали с тобой над проектом.;0;
121;She danced with [you:Type.personal-obj,p2] at the party.;Она танцевала с вами на вечеринке.;0;
122;The teacher was impressed by [you:Type.personal-obj,s2].;Учитель был впечатлён тобой.;0;
123;He argued with [you:Type.personal-obj,s2] about politics.;Он спорил с тобой о политике.;0;
124;They traveled with [you:Type.personal-obj,s2] last summer.;Они путешествовали с тобой прошлым летом.;0;
125;They talked about [you:Type.personal-obj,s2] yesterday.;Они говорили о тебе вчера.;0;
126;The story is about [you:Type.personal-obj,s2].;История о тебе.;0;
127;She always thinks about [you:Type.personal-obj,s2].;Она всегда думает о тебе.;0;
128;Don’t worry about [you:Type.personal-obj,s2].;Не переживай о тебе.;0;
129;What do you know about [yourself:Type.personal-obj,s2]?;Что ты знаешь о себе?;0;
130;I saw [him:Type.personal-obj,s3m].;Я видел его в парке.;0;
131;They accused [him:Type.personal-obj,s3m] of lying.;Они обвинили его во лжи.;0;
132;She found [him:Type.personal-obj,s3m] sleeping.;Она нашла его спящим.;0;
133;The teacher praised [him:Type.personal-obj,s3m] for his work.;Учитель похвалил его за работу.;0;
134;I met [him:Type.personal-obj,s3m] yesterday.;Я встретил его вчера.;0;
135;She gave [him:Type.personal-obj,s3m] a gift.;Она дала ему подарок.;0;
136;They sent [him:Type.personal-obj,s3m] a letter.;Они отправили ему письмо.;0;
137;Can you show [him:Type.personal-obj,s3m] the way?;Можешь показать ему дорогу?;0;
138;The dog belongs to [him:Type.personal-obj,s3m].;Собака принадлежит ему.;0;
139;Tell [him:Type.personal-obj,s3m] the truth.;Скажи ему правду.;0;
140;They invited [him:Type.personal-obj,s3m] to the meeting.;Они пригласили его на встречу.;0;
141;She called [him:Type.personal-obj,s3m] yesterday.;Она звонила ему вчера.;0;
142;The dog followed [him:Type.personal-obj,s3m] home.;Собака пошла за ним домой.;0;
143;Please help [him:Type.personal-obj,s3m] with his project.;Пожалуйста, помогите ему с его проектом.;0;
144;I don't trust [him:Type.personal-obj,s3m].;Я не доверяю ему.;0;
145;They worked with [him:Type.personal-obj,s3m] on the project.;Они работали с ним над проектом.;0;
146;She danced with [him:Type.personal-obj,s3m] at the party.;Она танцевала с ним на вечеринке.;0;
147;The teacher was impressed by [him:Type.personal-obj,s3m].;Учитель был впечатлён им.;0;
148;He argued with [him:Type.personal-obj,s3m] about politics.;Он спорил с ним о политике.;0;
149;They traveled with [him:Type.personal-obj,s3m] last summer.;Они путешествовали с ним прошлым летом.;0;
150;They talked about [him:Type.personal-obj,s3m] yesterday.;Они говорили о нём вчера.;0;
151;The story is about [him:Type.personal-obj,s3m].;История о нём.;0;
152;She always thinks about [him:Type.personal-obj,s3m].;Она всегда думает о нём.;0;
153;Don’t worry about [him:Type.personal-obj,s3m].;Не переживай о нём.;0;
154;What do you know about [him:Type.personal-obj,s3m]?;Что ты знаешь о нём?;0;
155;I saw [her:Type.personal-obj,s3f] at the store.;Я видел её в магазине.;0;
156;They accused [her:Type.personal-obj,s3f] of cheating.;Они обвинили её в обмане.;0;
157;She praised the girl for [her:Type.personal-obj,s3f] efforts.;Она похвалила её за её усилия.;0;
158;I met [her:Type.personal-obj,s3f] last night.;Я встретил её вчера вечером.;0;
159;He followed [her:Type.personal-obj,s3f] to the park.;Он следовал за ней в парк.;0;
160;They gave [her:Type.personal-obj,s3f] a gift.;Они дали ей подарок.;0;
161;Can you pass [her:Type.personal-obj,s3f] the salt?;Можешь передать ей соль?;0;
162;The book belongs to [her:Type.personal-obj,s3f].;Эта книга принадлежит ей.;0;
163;He showed [her:Type.personal-obj,s3f] the way.;Он показал ей дорогу.;0;
164;Tell [her:Type.personal-obj,s3f] the truth.;Скажи ей правду.;0;
165;I love [her:Type.personal-obj,s3f].;Я люблю её.;0;
166;He called [her:Type.personal-obj,s3f] last night.;Он звонил ей вчера вечером.;0;
167;Please help [her:Type.personal-obj,s3f] with her homework.;Пожалуйста, помоги ей с домашним заданием.;0;
168;I don’t trust [her:Type.personal-obj,s3f].;Я не доверяю ей.;0;
169;They saw [her:Type.personal-obj,s3f] at the mall.;Они видели её в торговом центре.;0;
170;They worked with [her:Type.personal-obj,s3f] on the project.;Они работали с ней над проектом.;0;
171;She danced with [her:Type.personal-obj,s3f] at the party.;Она танцевала с ней на вечеринке.;0;
172;The teacher was impressed by [her:Type.personal-obj,s3f].;Учитель был впечатлён ею.;0;
173;He argued with [her:Type.personal-obj,s3f] about the topic.;Он спорил с ней о теме.;0;
174;They traveled with [her:Type.personal-obj,s3f] last summer.;Они путешествовали с ней прошлым летом.;0;
175;They talked about [her:Type.personal-obj,s3f] yesterday.;Они говорили о ней вчера.;0;
176;The story is about [her:Type.personal-obj,s3f].;История о ней.;0;
177;She always thinks about [her:Type.personal-obj,s3f].;Она всегда думает о ней.;0;
178;Don’t worry about [her:Type.personal-obj,s3f].;Не переживай о ней.;0;
179;What do you know about [her:Type.personal-obj,s3f]?;Что ты знаешь о ней?;0;
180;She saw [it:Type.personal-obj,s3n] on the table.;Она увидела его на столе.;0;
181;I took [it:Type.personal-obj,s3n] from the box.;Я взял его из коробки.;0;
182;They repaired [it:Type.personal-obj,s3n] yesterday.;Они починили его вчера.;0;
183;The teacher noticed [it:Type.personal-obj,s3n] immediately.;Учитель заметил его сразу.;0;
184;I remember [it:Type.personal-obj,s3n] very well.;Я очень хорошо помню его.;0;
185;She gave [it:Type.personal-obj,s3n] a name.;Она дала ему имя.;0;
186;They sent [it:Type.personal-obj,s3n] to the laboratory.;Они отправили его в лабораторию.;0;
187;He showed [it:Type.personal-obj,s3n] to his friend.;Он показал его своему другу.;0;
188;I offered [it:Type.personal-obj,s3n] to the team.;Я предложил его команде.;0;
189;They assigned [it:Type.personal-obj,s3n] a task.;Они назначили ему задачу.;0;
190;I found [it:Type.personal-obj,s3n] under the bed.;Я нашёл его под кроватью.;0;
191;She moved [it:Type.personal-obj,s3n] to another room.;Она передвинула его в другую комнату.;0;
192;They lost [it:Type.personal-obj,s3n] during the trip.;Они потеряли его во время поездки.;0;
193;Please fix [it:Type.personal-obj,s3n] as soon as possible.;Пожалуйста, почини его как можно скорее.;0;
194;He bought [it:Type.personal-obj,s3n] yesterday.;Он купил его вчера.;0;
195;They worked with [it:Type.personal-obj,s3n] all night.;Они работали с ним всю ночь.;0;
196;She cleaned the floor with [it:Type.personal-obj,s3n].;Она убрала пол с его помощью.;0;
197;He impressed everyone with [it:Type.personal-obj,s3n].;Он впечатлил всех с его помощью.;0;
198;They solved the problem with [it:Type.personal-obj,s3n].;Они решили проблему с его помощью.;0;
199;I decorated the room with [it:Type.personal-obj,s3n].;Я украсил комнату с его помощью.;0;
200;They talked about [it:Type.personal-obj,s3n] yesterday.;Они говорили о нём вчера.;0;
201;What do you know about [it:Type.personal-obj,s3n]?;Что ты знаешь о нём?;0;
202;Don’t worry about [it:Type.personal-obj,s3n].;Не переживай о нём.;0;
203;The story is about [it:Type.personal-obj,s3n].;История о нём.;0;
204;She always thinks about [it:Type.personal-obj,s3n].;Она всегда думает о нём.;0;
205;They saw [us:Type.personal-obj,p1] at the party.;Они видели нас на вечеринке.;0;
206;She invited [us:Type.personal-obj,p1] to her house.;Она пригласила нас к себе домой.;0;
207;The teacher praised [us:Type.personal-obj,p1] for our work.;Учитель похвалил нас за нашу работу.;0;
208;He remembered [us:Type.personal-obj,p1] from school.;Он вспомнил нас из школы.;0;
209;They accused [us:Type.personal-obj,p1] of cheating.;Они обвинили нас в обмане.;0;
210;She gave [us:Type.personal-obj,p1] a gift.;Она дала нам подарок.;0;
211;They sent [us:Type.personal-obj,p1] a letter.;Они отправили нам письмо.;0;
212;Can you show [us:Type.personal-obj,p1] the way?;Можешь показать нам дорогу?;0;
213;The book belongs to [us:Type.personal-obj,p1].;Эта книга принадлежит нам.;0;
214;Tell [us:Type.personal-obj,p1] the truth.;Скажи нам правду.;0;
215;They invited [us:Type.personal-obj,p1] to the party.;Они пригласили нас на вечеринку.;0;
216;Please help [us:Type.personal-obj,p1] with the project.;Пожалуйста, помогите нам с проектом.;0;
217;I saw [us:Type.personal-obj,p1] in the mirror.;Я видел нас в зеркале.;0;
218;She called [us:Type.personal-obj,p1] yesterday.;Она звонила нам вчера.;0;
219;The dog followed [us:Type.personal-obj,p1] home.;Собака пошла за нами домой.;0;
220;They worked with [us:Type.personal-obj,p1] on the project.;Они работали с нами над проектом.;0;
221;She danced with [us:Type.personal-obj,p1] at the party.;Она танцевала с нами на вечеринке.;0;
222;The teacher was impressed by [us:Type.personal-obj,p1].;Учитель был впечатлён нами.;0;
223;He argued with [us:Type.personal-obj,p1] about politics.;Он спорил с нами о политике.;0;
224;They traveled with [us:Type.personal-obj,p1] last summer.;Они путешествовали с нами прошлым летом.;0;
225;They talked about [us:Type.personal-obj,p1] yesterday.;Они говорили о нас вчера.;0;
226;The story is about [us:Type.personal-obj,p1].;История о нас.;0;
227;She always thinks about [us:Type.personal-obj,p1].;Она всегда думает о нас.;0;
228;Don’t worry about [us:Type.personal-obj,p1].;Не переживай о нас.;0;
229;What do you know about [us:Type.personal-obj,p1]?;Что ты знаешь о нас?;0;
230;I saw [them:Type.personal-obj,p3] at the park.;Я видел их в парке.;0;
231;They invited [them:Type.personal-obj,p3] to the meeting.;Они пригласили их на встречу.;0;
232;She remembered [them:Type.personal-obj,p3] from school.;Она вспомнила их из школы.;0;
233;We need to talk to [them:Type.personal-obj,p3].;Нам нужно поговорить с ними.;0;
234;They accused [them:Type.personal-obj,p3] of lying.;Они обвинили их во лжи.;0;
235;She gave [them:Type.personal-obj,p3] a gift.;Она дала им подарок.;0;
236;They sent [them:Type.personal-obj,p3] a letter.;Они отправили им письмо.;0;
237;Can I show [them:Type.personal-obj,p3] something?;Могу показать им что-то?;0;
238;The book belongs to [them:Type.personal-obj,p3].;Эта книга принадлежит им.;0;
239;Tell [them:Type.personal-obj,p3] the truth.;Скажи им правду.;0;
240;I trust [them:Type.personal-obj,p3].;Я доверяю им.;0;
241;Please help [them:Type.personal-obj,p3] with the project.;Пожалуйста, помогите им с проектом.;0;
242;They saw [them:Type.personal-obj,p3] at the party.;Они видели их на вечеринке.;0;
243;She called [them:Type.personal-obj,p3] yesterday.;Она звонила им вчера.;0;
244;He invited [them:Type.personal-obj,p3] to dinner.;Он пригласил их на ужин.;0;
245;They worked with [them:Type.personal-obj,p3] on the project.;Они работали с ними над проектом.;0;
246;She danced with [them:Type.personal-obj,p3] at the party.;Она танцевала с ними на вечеринке.;0;
247;The teacher was impressed by [them:Type.personal-obj,p3].;Учитель был впечатлён ими.;0;
248;He argued with [them:Type.personal-obj,p3] about politics.;Он спорил с ними о политике.;0;
249;They traveled with [them:Type.personal-obj,p3] last summer.;Они путешествовали с ними прошлым летом.;0;
250;They talked about [them:Type.personal-obj,p3] yesterday.;Они говорили о них вчера.;0;
251;The story is about [them:Type.personal-obj,p3].;История о них.;0;
252;She always thinks about [them:Type.personal-obj,p3].;Она всегда думает о них.;0;
253;Don’t worry about [them:Type.personal-obj,p3].;Не переживай о них.;0;
254;What do you know about [them:Type.personal-obj,p3]?;Что ты знаешь о них?;0;
255;This pen is [mine:Type.poss-pron,s1].;Эта ручка моя.;0;
256;The last word is [mine:Type.poss-pron,s1].;Последнее слово за мной.;0;
257;The apartment is [mine:Type.poss-pron,s1].;Квартира моя.;0;
258;This responsibility is [mine:Type.poss-pron,s1].;Эта ответственность моя.;0;
259;That chair is [mine:Type.poss-pron,s1].;Тот стул мой.;0;
260;This house is [yours:Type.poss-pron,s2].;Этот дом твой.;0;
261;The final choice is [yours:Type.poss-pron,s2].;Окончательный выбор за тобой.;0;
262;Is this laptop [yours:Type.poss-pron,s2]?;Этот ноутбук твой?;0;
263;That opportunity was [yours:Type.poss-pron,s2].;Эта возможность была твоей.;0;
264;This task is [yours:Type.poss-pron,s2].;Эта задача твоя.;0;
265;The mistake was [his:Type.poss-pron,s3m].;Ошибка была его.;0;
266;This project is [his:Type.poss-pron,s3m].;Этот проект его.;0;
267;The responsibility was [his:Type.poss-pron,s3m].;Ответственность была его.;0;
268;The decision is [his:Type.poss-pron,s3m].;Решение его.;0;
269;That achievement was [his:Type.poss-pron,s3m].;Это достижение было его.;0;
270;The suitcase is [hers:Type.poss-pron,s3f].;Чемодан её.;0;
271;The credit is [hers:Type.poss-pron,s3f].;Заслуга её.;0;
272;Is that phone [hers:Type.poss-pron,s3f]?;Этот телефон её?;0;
273;The complaint was [hers:Type.poss-pron,s3f].;Жалоба была её.;0;
274;That painting is [hers:Type.poss-pron,s3f].;Та картина её.;0;
275;The influence is [its:Type.poss-pron,s3n].;Влияние его.;0;
276;This power is [its:Type.poss-pron,s3n].;Эта сила его.;0;
277;The charm is [its:Type.poss-pron,s3n].;Очарование его.;0;
278;The meaning is [its:Type.poss-pron,s3n].;Значение его.;0;
279;The territory is [its:Type.poss-pron,s3n].;Территория его.;0;
280;The dream is [ours:Type.poss-pron,p1].;Мечта наша.;0;
281;This future is [ours:Type.poss-pron,p1].;Это будущее наше.;0;
282;The burden is [ours:Type.poss-pron,p1].;Бремя наше.;0;
283;The idea was [ours:Type.poss-pron,p1].;Идея была нашей.;0;
284;The happiness is [ours:Type.poss-pron,p1].;Счастье наше.;0;
285;The land is [theirs:Type.poss-pron,p3].;Земля их.;0;
286;The duty is [theirs:Type.poss-pron,p3].;Обязанность их.;0;
287;That reward was [theirs:Type.poss-pron,p3].;Эта награда была их.;0;
288;The authority is [theirs:Type.poss-pron,p3].;Власть их.;0;
289;The responsibility is [theirs:Type.poss-pron,p3].;Ответственность их.;0;
290;This is [my:Type.poss-adj,s1] book.;Это моя книга.;0;
291;[My:Type.poss-adj,s1] car is very old.;Моя машина очень старая.;0;
292;[My:Type.poss-adj,s1] house is near the park.;Мой дом рядом с парком.;0;
293;[My:Type.poss-adj,s1] friend is waiting for me.;Мой друг ждёт меня.;0;
294;[My:Type.poss-adj,s1] phone is charging.;Мой телефон заряжается.;0;
295;[Your:Type.poss-adj,s2] efforts matter.;Ваши усилия важны.;0;
296;[Your:Type.poss-adj,s2] house is beautiful.;Ваш дом красивый.;0;
297;Where is [your:Type.poss-adj,s2] car?;Где ваша машина?;0;
298;[Your:Type.poss-adj,s2] kids are very polite.;Ваши дети очень вежливы.;0;
299;I like [your:Type.poss-adj,s2] idea.;Мне нравится ваша идея.;0;
300;[His:Type.poss-adj,s3m] dog is friendly.;Его собака дружелюбная.;0;
301;[His:Type.poss-adj,s3m] house is very big.;Его дом очень большой.;0;
302;I like [his:Type.poss-adj,s3m] car.;Мне нравится его машина.;0;
303;[His:Type.poss-adj,s3m] work is inspiring.;Его работа вдохновляющая.;0;
304;Where is [his:Type.poss-adj,s3m] book?;Где его книга?;0;
305;[Her:Type.poss-adj,s3f] ideas are brilliant.;Её идеи блестящие.;0;
