id;question;extra;suspicious_status;suspicious_note
# personal-subj.identification
0;[I:Type.personal-subj,s1] like coffee.;Мне нравится кофе.;0;
1;[I:Type.personal-subj,s1] will call you tomorrow.;Я позвоню тебе завтра.;0;
2;[I:Type.personal-subj,s1] am here.;Я здесь.;0;
3;[I:Type.personal-subj,s1] don't understand this.;Я этого не понимаю.;0;
4;[I:Type.personal-subj,s1] need help.;Мне нужна помощь.;0;
5;[You:Type.personal-subj,s2] are my friend.;Ты мой друг.;0;
6;[You:Type.personal-subj,s2] can do it.;Ты можешь это сделать.;0;
7;[You:Type.personal-subj,s2] look tired.;Ты выглядишь уставшим.;0;
8;[You:Type.personal-subj,s2] coming with us?;Ты пойдёшь с нами?;0;
9;[You:Type.personal-subj,s2] forgot your keys.;Ты забыл свои ключи.;0;
10;[He:Type.personal-subj,s3m] is a teacher.;Он учитель.;0;
11;[He:Type.personal-subj,s3m] works every day.;Он работает каждый день.;0;
12;[He:Type.personal-subj,s3m] likes pizza.;Он любит пиццу.;0;
13;[He:Type.personal-subj,s3m] will help you.;Он поможет тебе.;0;
14;[He:Type.personal-subj,s3m] went to the store.;Он пошел в магазин.;0;
15;[She:Type.personal-subj,s3f] loves coffee.;Она любит кофе.;0;
16;[She:Type.personal-subj,s3f] is very kind.;Она очень добрая.;0;
17;[She:Type.personal-subj,s3f] told me the truth.;Она сказала мне правду.;0;
18;[She:Type.personal-subj,s3f] is reading a book.;Она читает книгу.;0;
19;[She:Type.personal-subj,s3f] lives nearby.;Она живёт рядом.;0;
20;[It:Type.personal-subj,s3n] is raining.;Идёт дождь.;0;
21;[It:Type.personal-subj,s3n] looks delicious.;Оно выглядит вкусно.;0;
22;[It:Type.personal-subj,s3n] is very expensive.;Оно очень дорого.;0;
23;[I:Type.personal-subj,s1] found it in the drawer.;Я нашел это в ящике.;0;
24;[It:Type.personal-subj,s3n] is a good idea.;Это хорошая идея.;0;
25;[We:Type.personal-subj,p1] are happy.;Мы счастливы.;0;
26;[We:Type.personal-subj,p1] will meet tomorrow.;Мы встретимся завтра.;0;
27;[We:Type.personal-subj,p1] like this place.;Нам нравится это место.;0;
28;[We:Type.personal-subj,p1] are going to the park.;Мы идём в парк.;0;
29;[We:Type.personal-subj,p1] need more time.;Нам нужно больше времени.;0;
30;[You:Type.personal-subj,s2] are welcome here.;Вы здесь желанны.;0;
31;[You:Type.personal-subj,s2] should try this.;Вы должны попробовать это.;0;
32;[You:Type.personal-subj,s2] are very polite.;Вы очень вежливы.;0;
33;[You:Type.personal-subj,s2] ready for the meeting?;Вы готовы к встрече?;0;
34;[You:Type.personal-subj,s2] did a great job.;Вы отлично справились.;0;
35;[They:Type.personal-subj,p3] are coming.;Они идут.;0;
36;[They:Type.personal-subj,p3] work together.;Они работают вместе.;0;
37;[They:Type.personal-subj,p3] have a big house.;У них большой дом.;0;
38;[They:Type.personal-subj,p3] here yet?;Они уже здесь?;0;
39;[They:Type.personal-subj,p3] enjoy traveling.;Им нравится путешествовать.;0;
40;[I:Type.personal-subj,s1] was surprised when I saw the results.;Я был удивлён, когда увидел результаты.;0;
41;She told me that [I:Type.personal-subj,s1] should try harder.;Она сказала мне, что я должен стараться больше.;0;
42;We all know that [you:Type.personal-subj,s2] have the skills to succeed.;Мы все знаем, что у тебя есть навыки, чтобы добиться успеха.;0;
43;They asked if [you:Type.personal-subj,s2] were available for the meeting.;Они спросили, свободны ли вы для встречи.;0;
44;The teacher explained why [he:Type.personal-subj,s3m] missed the deadline.;Учитель объяснил, почему он пропустил крайний срок.;0;
45;She couldn't believe that [he:Type.personal-subj,s3m] had lied to her.;Она не могла поверить, что он ей солгал.;0;
46;Everyone was amazed by how fast [she:Type.personal-subj,s3f] solved the problem.;Все были поражены, как быстро она решила проблему.;0;
47;We had no idea that [she:Type.personal-subj,s3f] spoke five languages.;Мы не знали, что она говорит на пяти языках.;0;
48;The scientist proved that [it:Type.personal-subj,s3n] was possible to travel faster.;Учёный доказал, что это возможно путешествовать быстрее.;0;
49;They debated whether [it:Type.personal-subj,s3n] should be changed.;Они спорили, стоит ли это изменить.;0;
50;My friends and I realized that [we:Type.personal-subj,p1] needed a new plan.;Мои друзья и я поняли, что нам нужен новый план.;0;
51;The manager reminded us that [we:Type.personal-subj,p1] had to finish by noon.;Менеджер напомнил нам, что мы должны закончить к полудню.;0;
52;Can you explain why [you:Type.personal-subj,s2] made that decision?;Можешь объяснить, почему ты принял такое решение?;0;
53;They were shocked that [you:Type.personal-subj,s2] knew the answer.;Они были шокированы, что ты знал ответ.;0;
54;She was worried that [he:Type.personal-subj,s3m] wouldn't make it on time.;Она волновалась, что он не успеет вовремя.;0;
55;The team believed that [he:Type.personal-subj,s3m] could lead them to victory.;Команда верила, что он сможет привести их к победе.;0;
56;Everyone agreed that [she:Type.personal-subj,s3f] deserved the award.;Все согласились, что она заслужила награду.;0;
57;We wondered why [she:Type.personal-subj,s3f] hadn't responded yet.;Мы задумались, почему она ещё не ответила.;0;
58;It was clear that [it:Type.personal-subj,s3n] wouldn't work as planned.;Было ясно, что это не сработает, как планировалось.;0;
59;The engineer confirmed that [it:Type.personal-subj,s3n] was built correctly.;Инженер подтвердил, что это было построено правильно.;0;
60;They knew that [we:Type.personal-subj,p1] were trying our best.;Они знали, что мы старались изо всех сил.;0;
61;The instructor told us that [we:Type.personal-subj,p1] needed more practice.;Инструктор сказал нам, что нам нужно больше практики.;0;
62;She asked whether [you:Type.personal-subj,s2] wanted to join the project.;Она спросила, хочешь ли ты присоединиться к проекту.;0;
63;The boss emphasized that [you:Type.personal-subj,s2] must be on time.;Босс подчеркнул, что ты должен быть вовремя.;0;
64;We suspected that [he:Type.personal-subj,s3m] was hiding something.;Мы подозревали, что он что-то скрывает.;0;
65;They admitted that [he:Type.personal-subj,s3m] was the best candidate.;Они признали, что он был лучшим кандидатом.;0;
66;The professor mentioned that [she:Type.personal-subj,s3f] had done excellent research.;Профессор упомянул, что она провела отличное исследование.;0;
67;Her friend revealed that [she:Type.personal-subj,s3f] had moved abroad.;Её друг рассказал, что она переехала за границу.;0;
68;The expert concluded that [it:Type.personal-subj,s3n] was a breakthrough discovery.;Эксперт пришёл к выводу, что это было прорывное открытие.;0;
69;They agreed that [it:Type.personal-subj,s3n] was the right decision.;Они согласились, что это было правильное решение.;0;
70;We insisted that [we:Type.personal-subj,p1] should try again.;Мы настаивали, что мы должны попробовать снова.;0;
71;They mentioned that [we:Type.personal-subj,p1] had the necessary experience.;Они упомянули, что у нас был необходимый опыт.;0;
72;The manager confirmed that [you:Type.personal-subj,s2] had completed the task.;Менеджер подтвердил, что ты завершил задание.;0;
73;He warned that [you:Type.personal-subj,s2] should be careful.;Он предупредил, что тебе следует быть осторожным.;0;
74;The scientist explained why [they:Type.personal-subj,p3] changed the experiment.;Учёный объяснил, почему они изменили эксперимент.;0;
75;We learned that [they:Type.personal-subj,p3] had already left.;Мы узнали, что они уже ушли.;0;
76;The journalist reported that [they:Type.personal-subj,p3] had discovered new evidence.;Журналист сообщил, что они обнаружили новые доказательства.;0;
77;She commented that [they:Type.personal-subj,p3] seemed very confident.;Она прокомментировала, что они казались очень уверенными.;0;
78;It was obvious that [they:Type.personal-subj,p3] needed help.;Было очевидно, что им нужна помощь.;0;
79;The report stated that [they:Type.personal-subj,p3] had reached an agreement.;В отчёте говорилось, что они достигли соглашения.;0;

# personal-subj.nuances(1 - It при уточнении личности)
80;It was my brother who helped me move, not my neighbor.;Это мой брат помог мне переехать, а не сосед.;0;  
81;I heard a voice in the hallway. Was it your father?;Я услышал голос в коридоре. Это был твой отец?;0;  
82;It was Sarah who told me the truth, not Mark.;Это Сара сказала мне правду, а не Марк.;0;  
83;Was it your sister I saw at the mall yesterday?;Это была твоя сестра, кого я видел вчера в торговом центре?;0;  
84;It wasn’t John who called you, it was Mike.;Это был не Джон, кто тебе звонил, а Майк.;0;  
85;It was my best friend who stood by me through hard times.;Это мой лучший друг поддерживал меня в трудные времена.;0;  
86;It wasn’t the teacher who gave us extra homework, it was the principal.;Это не учитель дал нам дополнительное задание, а директор.;0;  
87;Was it Lisa who won the competition?;Это Лиза выиграла соревнование?;0;  
88;It was my uncle who took me to the airport.;Это мой дядя отвез меня в аэропорт.;0;  
89;It wasn’t your idea, it was mine.;Это была не твоя идея, а моя.;0;  

# personal-subj.nuances(it к животным)
The dog is barking loudly → [It:t.Personal] is barking loudly; Он/Она лает громко.;0;
The bird is flying in the sky → [It:t.Personal] is flying in the sky; Она летит в небе.;0;
The cat is hiding under the bed → [It:t.Personal] is hiding under the bed; Он/Она прячется под кроватью.;0;
The rabbit is eating a carrot → [It:t.Personal] is eating a carrot; Он/Она ест морковь.;0;
The fish is swimming in the tank → [It:t.Personal] is swimming in the tank; Она плавает в аквариуме.;0;
The cow is standing in the field → [It:t.Personal] is standing in the field; Она стоит в поле.;0;
The horse is running fast → [It:t.Personal] is running fast; Он/Она быстро бежит.;0;
The spider is crawling on the wall → [It:t.Personal] is crawling on the wall; Он/Она ползёт по стене.;0;
The bee is buzzing around the flower → [It:t.Personal] is buzzing around the flower; Она жужжит вокруг цветка.;0;
The squirrel is climbing the tree → [It:t.Personal] is climbing the tree; Она карабкается на дерево.;0;

# personal-subj.nuances(2 - порядок местоимений)
[You and I] should go to the gym together. (I, you); Мы с тобой должны пойти в спортзал вместе.;0;
[You and I] should work on this project together. (I, you); Мы с тобой должны работать над этим проектом вместе.;0;
[She and I] have been friends since childhood. (I, she); Мы с ней друзья с детства.;0;
[She and I] went to the same high school. (I, she); Мы с ней ходили в одну среднюю школу.;0;
[David and I] studied at the same university. (I, David); Мы с Дэвидом учились в одном университете.;0;
[Jessica and I] are preparing for the test. (I, Jessica); Мы с Джессикой готовимся к тесту.;0;
[Michael and I] were at the conference last year. (I, Michael); Мы с Майклом были на конференции в прошлом году.;0;
[My boss and I] will attend the meeting. (I, my boss); Мы с моим начальником посетим встречу.;0;
[My brother and I] enjoy playing video games. (I, my brother); Мы с моим братом любим играть в видеоигры.;0;
[My teacher and I] wrote an article on this topic. (I, my teacher); Мы с моим учителем написали статью на эту тему.;0;
[They and I] are planning a trip next month. (I, they); Мы с ними планируем поездку в следующем месяце.;0;
[They and I] often travel together. (I, they); Мы с ними часто путешествуем вместе.;0;
[You and he] have similar interests. (you, he); У вас с ним похожие интересы.;0;
[You and he] need to finish the report. (you, he); Вам с ним нужно закончить отчет.;0;
[You and she] should present the report. (you, she); Вам с ней следует представить отчет.;0;
[You and she] should take care of this issue. (you, she); Вам с ней следует заняться этим вопросом.;0;
[You and your sister] should decide together. (you, your sister); Вам с твоей сестрой следует решить это вместе.;0;
[You and we] will organize the party. (you, we); Мы с тобой организуем вечеринку.;0;
[You and they] need to prepare for the meeting. (you, they); Вам с ними нужно подготовиться к встрече.;0;
[You and my sister] need to talk about the event. (you, my sister); Вам с моей сестрой нужно поговорить о мероприятии.;0;
[You and they] have already finished the assignment. (you, they); Вы с ними уже закончили задание.;0;
[You and my cousin] are responsible for organizing the event. (you, my cousin); Вы с моим кузеном отвечаете за организацию мероприятия.;0;
[You and they] were chosen for the project. (you, they); Вас с ними выбрали для проекта.;0;
[You and Mark] should present the results. (you, Mark); Вам с Марком следует представить результаты.;0;

# personal-subj.nuances(3,4,5 - борьба разговорного с формальным)
My brother and [I:t.Personal,s1,f.Formal] went to a concert last night.; Мой брат и я ходили на концерт прошлой ночью.
My brother and [me:t.Personal,s1,f.Colloquial] went to a concert last night.; Мой брат и я ходили на концерт прошлой ночью.
My colleague and [I:t.Personal,s1,f.Formal] finished the report on time.; Мой коллега и я закончили отчёт вовремя.
My colleague and [me:t.Personal,s1,f.Colloquial] finished the report on time.; Мой коллега и я закончили отчёт вовремя.
Between you and [I:t.Personal,s1,f.Formal], I think he’s wrong. (часто слышится, но неверно); Между нами, я думаю, он неправ. (часто говорят, но это ошибка)
Between you and [me:t.Personal,s1,f.Colloquial], I think he’s wrong.; Между нами, я думаю, он неправ.
My parents and [I:t.Personal,s1,f.Formal] are going on vacation.; Мои родители и я едем в отпуск.
My parents and [me:t.Personal,s1,f.Colloquial] are going on vacation.; Мои родители и я едем в отпуск.
My best friend and [I:t.Personal,s1,f.Formal] planned the trip.; Мой лучший друг и я спланировали поездку.
My best friend and [me:t.Personal,s1,f.Colloquial] planned the trip.; Мой лучший друг и я спланировали поездку.
It was [I:t.Personal,s1,f.Formal] who told him the truth.; Это был я, кто сказал ему правду.
It was [me:t.Personal,s1,f.Colloquial] who told him the truth.; Это был я, кто сказал ему правду.
It is [I:t.Personal,s1,f.Formal] who deserves the credit.; Именно я заслуживаю признания.
It is [me:t.Personal,s1,f.Colloquial] who deserves the credit.; Именно я заслуживаю признания.
It was [they:t.Personal,p2,f.Formal] who called first.; Это они позвонили первыми.
It was [them:t.Personal,p2,f.Colloquial] who called first.; Это они позвонили первыми.
It was [we:t.Personal,p1,f.Formal] who volunteered.; Это мы вызвались добровольно.
It was [us:t.Personal,p1,f.Colloquial] who volunteered.; Это мы вызвались добровольно.
No one except [he:t.Personal,s3m,f.Formal] knew the answer.; Никто, кроме него, не знал ответа.
No one except [him:t.Personal,s3m,f.Colloquial] knew the answer.; Никто, кроме него, не знал ответа.
Everyone except [she:t.Personal,s3f,f.Formal] arrived on time.; Все, кроме неё, пришли вовремя.
Everyone except [her:t.Personal,s3f,f.Colloquial] arrived on time.; Все, кроме неё, пришли вовремя.
She is taller than [I:t.Personal,s3f,f.Formal].; Она выше, чем я.;0;
She is taller than [me:t.Personal,s3f,f.Colloquial].; Она выше меня.;0;
No one can do it but [she:t.Personal,s3f,f.Formal].; Никто не может сделать это, кроме неё.;0;
No one can do it but [her:t.Personal,s3f,f.Colloquial].; Никто не может сделать это, кроме неё.;0;
No one understands it but [he:t.Personal,s3f,f.Formal].; Никто этого не понимает, кроме него.;0;
No one understands it but [him:t.Personal,s3f,f.Colloquial].; Никто этого не понимает, кроме него.;0;
They invited no one but [we:t.Personal,p1,f.Formal].; Они никого не пригласили, кроме нас.;0;
They invited no one but [us:t.Personal,p1,f.Colloquial].; Они никого не пригласили, кроме нас.;0;
Nothing matters but [she:t.Personal,s3f,f.Formal].; Ничто не имеет значения, кроме неё.;0;
Nothing matters but [her:t.Personal,s3f,f.Colloquial].; Ничто не имеет значения, кроме неё.;0;
No one saw it except [I:t.Personal,s1,f.Formal].; Никто этого не видел, кроме меня.;0;
No one saw it except [me:t.Personal,s1,f.Colloquial].; Никто этого не видел, кроме меня.;0;
We spoke to no one except [they:t.Personal,p3,f.Formal].; Мы ни с кем не разговаривали, кроме них.;0;
We spoke to no one except [them:t.Personal,p3,f.Colloquial].; Мы ни с кем не разговаривали, кроме них.;0;
She is taller than [he:t.Personal,s3f,f.Formal].; Она выше, чем он.;0;
She is taller than [him:t.Personal,s3f,f.Colloquial].; Она выше его.;0;
They are stronger than [we:t.Personal,p1,f.Formal].; Они сильнее, чем мы.;0;
They are stronger than [us:t.Personal,p1,f.Colloquial].; Они сильнее нас.;0;
I know more about this than [she:t.Personal,s3f,f.Formal].; Я знаю об этом больше, чем она.;0;
I know more about this than [her:t.Personal,s3f,f.Colloquial].; Я знаю об этом больше, чем она.;0;
He is as fast as [she:t.Personal,s3f,f.Formal].; Он так же быстр, как она.;0;
He is as fast as [her:t.Personal,s3f,f.Colloquial].; Он так же быстр, как она.;0;
We are as experienced as [they:t.Personal,p3,f.Formal].; У нас столько же опыта, сколько у них.;0;
We are as experienced as [them:t.Personal,p3,f.Colloquial].; У нас столько же опыта, сколько у них.;0;
You know as well as [I:t.Personal,s1,f.Formal] do that it's true.; Ты знаешь так же хорошо, как и я, что это правда.;0;
You know as well as [me:t.Personal,s1,f.Colloquial] do that it's true.; Ты знаешь так же хорошо, как и я, что это правда.;0;
Who is responsible for this mistake? – Not [I:t.Personal,s1,f.Formal]!; Кто несёт ответственность за эту ошибку? – Не я!;0;
Who is responsible for this mistake? – Not [Me:t.Personal,s1,f.Colloquial]!; Кто несёт ответственность за эту ошибку? – Не я!;0;
Who wants coffee? – [I:t.Personal,s1,f.Formal] do!; Кто хочет кофе? – Я хочу!;0;
Who wants coffee? – [Me:t.Personal,s1,f.Colloquial]!; Кто хочет кофе? – Я!;0;
Who told you that? – [He:t.Personal,s3,f.Formal] did.; Кто тебе это сказал? – Он сказал.;0;
Who told you that? – [Him:t.Personal,s3,f.Colloquial].; Кто тебе это сказал? – Он.;0;
Who took my pen? – Not [I:t.Personal,s1,f.Formal]!; Кто взял мою ручку? – Не я!;0;
Who took my pen? – Not [Me:t.Personal,s1,f.Colloquial]!; Кто взял мою ручку? – Не я!;0;
Who’s going first? – [I:t.Personal,s1,f.Formal] am.; Кто идёт первым? – Я иду.;0;
Who’s going first? – [Me:t.Personal,s1,f.Colloquial].; Кто идёт первым? – Я.;0;
Who helped you? – [She:t.Personal,s3,f.Formal] did.; Кто тебе помог? – Она помогла.;0;
Who helped you? – [Her:t.Personal,s3,f.Colloquial].; Кто тебе помог? – Она.;0;
Who’s in charge here? – [I:t.Personal,s1,f.Formal] am.; Кто здесь главный? – Я.;0;
Who’s in charge here? – [Me:t.Personal,s1,f.Colloquial].; Кто здесь главный? – Я.;0;
Who ate the last slice? – Not [I:t.Personal,s1,f.Formal]!; Кто съел последний кусок? – Не я!;0;
Who ate the last slice? – Not [Me:t.Personal,s1,f.Colloquial]!; Кто съел последний кусок? – Не я!;0;
Who called earlier? – [They:t.Personal,s3,f.Formal] did.; Кто звонил раньше? – Они звонили.;0;
Who called earlier? – [Them:t.Personal,s3,f.Colloquial].; Кто звонил раньше? – Они.;0;
Who’s ready to leave? – [We:t.Personal,p1,f.Formal] are.; Кто готов уходить? – Мы готовы.;0;
Who’s ready to leave? – [Us:t.Personal,p1,f.Colloquial].; Кто готов уходить? – Мы.;0;
Who has been using my laptop? – Not [I:t.Personal,s1,f.Formal]!; Кто пользовался моим ноутбуком? – Не я!;0;
Who has been using my laptop? – Not [Me:t.Personal,s1,f.Colloquial]!; Кто пользовался моим ноутбуком? – Не я!;0;
Who will have finished the project by tomorrow? – [I:t.Personal,s1,f.Formal] will have.; Кто закончит проект к завтрашнему дню? – Я закончу.;0;
Who will have finished the project by tomorrow? – [Me:t.Personal,s1,f.Colloquial].; Кто закончит проект к завтрашнему дню? – Я.;0;
Who had already left when you arrived? – [She:t.Personal,s3,f.Formal] had.; Кто уже ушёл, когда ты приехал? – Она ушла.;0;
Who had already left when you arrived? – [Her:t.Personal,s3,f.Colloquial].; Кто уже ушёл, когда ты приехал? – Она.;0;
Who would have helped if they had known? – [We:t.Personal,p1,f.Formal] would have.; Кто бы помог, если бы знал? – Мы бы помогли.;0;
Who would have helped if they had known? – [Us:t.Personal,p1,f.Colloquial].; Кто бы помог, если бы знал? – Мы.;0;
Who is supposed to be leading this meeting? – [He:t.Personal,s3,f.Formal] is.; Кто должен вести эту встречу? – Он.;0;
Who is supposed to be leading this meeting? – [Him:t.Personal,s3,f.Colloquial].; Кто должен вести эту встречу? – Он.;0;
