id;question;extra;suspicious_status;suspicious_note
622;The teacher said [no one:Type.negative,Animate,s,f.frml] passed the test.;Учитель сказал, что никто не сдал тест.;0;
623;[No one:Type.negative,Animate,s,f.frml] in the group understood the question.;Никто в группе не понял вопрос.;0;
624;She spoke to [no one:Type.negative,Animate,s,f.frml] about her problem.;Она ни с кем не говорила о своей проблеме.;0;
625;We invited many people, but [no one:Type.negative,Animate,s,f.frml] showed up.;Мы пригласили многих, но никто не пришёл.;0;
626;[nobody:Type.negative,Animate,s,f.ntrl] saw him.;Никто его не видел.;0;
627;[nobody:Type.negative,Animate,s,f.ntrl] was in the room.;Никого не было в комнате.;0;
628;[nobody:Type.negative,Animate,s,f.ntrl] can help with this task.;Никто не может помочь с этим заданием.;0;
629;[nobody:Type.negative,Animate,s,f.ntrl] believed her story.;Никто не поверил её истории.;0;
630;[nobody:Type.negative,Animate,s,f.ntrl] is answering the phone.;Никто не отвечает на телефон.;0;
631;[Nobody:Type.negative,Animate,s,f.ntrl] in the office noticed the mistake.;Никто в офисе не заметил ошибку.;0;
632;He asked for help, but [nobody:Type.negative,Animate,s,f.ntrl] was available.;Он попросил помощи, но никто не был доступен.;0;
633;She waited for a response, but [nobody:Type.negative,Animate,s,f.ntrl] replied.;Она ждала ответа, но никто не ответил.;0;
634;He needed support, but [nobody:Type.negative,Animate,s,f.ntrl] stood by him.;Ему нужна была поддержка, но никто его не поддержал.;0;
635;[none:Type.negative,a.y/n,d.group] of them agreed.;Никто из них не согласился.;0;
636;[none:Type.negative,a.y/n,d.group] of the plans worked.;Ни один из планов не сработал.;0;
637;[none:Type.negative,a.y/n,d.group] of the students passed the exam.;Никто из студентов не сдал экзамен.;0;
638;[none:Type.negative,a.y/n,d.group] of us knew what to do.;Никто из нас не знал, что делать.;0;
639;[none:Type.negative,a.y/n,d.group] of the cookies are left.;Печенье закончилось.;0;
640;[None:Type.negative,a.y/n,d.group] of my friends like this movie.;Никому из моих друзей не нравится этот фильм.;0;
641;[None:Type.negative,a.y/n,d.group] of them remembered the rule.;Никто из них не вспомнил правило.;0;
642;He asked for cookies, but [none:Type.negative,a.y/n,d.group] were left.;Он попросил печенье, но его не осталось.;0;
643;She checked the messages, but [none:Type.negative,a.y/n,d.group] were unread.;Она проверила сообщения, но непрочитанных не осталось.;0;
644;We looked for volunteers, but [none:Type.negative,a.y/n,d.group] wanted to help.;Мы искали добровольцев, но никто не захотел помочь.;0;
645;I wanted answers, but [none:Type.negative,a.y/n,d.group] of them made sense.;Я хотел получить ответы, но ни один из них не имел смысла.;0;
646;They respect [each other:Type.reciprocal,d.2,f.ntrl/frml].;Они уважают друг друга.;0;
647;We always support [each other:Type.reciprocal,d.2,f.ntrl/frml].;Мы всегда поддерживаем друг друга.;0;
648;John and Lisa looked at [each other:Type.reciprocal,d.2,f.ntrl/frml] in surprise.;Джон и Лиза удивленно посмотрели друг на друга.;0;
649;They helped [each other:Type.reciprocal,d.2,f.ntrl/frml] with their homework.;Они помогали друг другу с домашней работой.;0;
650;The two brothers argued with [each other:Type.reciprocal,d.2,f.ntrl/frml] a lot.;Эти два брата часто спорили друг с другом.;0;
651;The couple wrote letters to [each other:Type.reciprocal,d.2,f.ntrl/frml] for years.;Эта пара писала друг другу письма годами.;0;
652;Sarah and Tom smiled at [each other:Type.reciprocal,d.2,f.ntrl/frml].;Сара и Том улыбнулись друг другу.;0;
653;The rivals tried to outsmart [each other:Type.reciprocal,d.2,f.ntrl/frml].;Соперники пытались перехитрить друг друга.;0;
654;We called [each other:Type.reciprocal,d.2,f.ntrl/frml] every evening.;Мы звонили друг другу каждый вечер.;0;
655;They shared their secrets with [each other:Type.reciprocal,d.2,f.ntrl/frml].;Они делились своими секретами друг с другом.;0;
656;The students in the class often help [each other:Type.reciprocal,d.grp,f.ntrl].;Ученики в классе часто помогают друг другу.;0;
657;We should listen to [each other:Type.reciprocal,d.grp,f.ntrl] more carefully.;Нам стоит внимательнее слушать друг друга.;0;
658;The kids were throwing the ball to [each other:Type.reciprocal,d.grp,f.ntrl].;Дети перекидывали мяч друг другу.;0;
659;The musicians in the band inspire [each other:Type.reciprocal,d.grp,f.ntrl].;Музыканты в группе вдохновляют друг друга.;0;
660;Friends should always be there for [each other:Type.reciprocal,d.grp,f.ntrl].;Друзья всегда должны поддерживать друг друга.;0;
661;The participants in the game challenged [each other:Type.reciprocal,d.grp,f.ntrl].;Участники игры бросали вызовы друг другу.;0;
662;They laughed and joked with [each other:Type.reciprocal,d.grp,f.ntrl] all evening.;Они весь вечер смеялись и шутили друг с другом.;0;
663;The team members worked closely with [each other:Type.reciprocal,d.grp,f.ntrl].;Члены команды тесно работали друг с другом.;0;
664;We exchanged gifts with [each other:Type.reciprocal,d.grp,f.ntrl] during the holidays.;Мы обменялись подарками друг с другом в праздники.;0;
665;The neighbors in the community support [each other:Type.reciprocal,d.grp,f.ntrl].;Соседи в сообществе поддерживают друг друга.;0;
666;The colleagues addressed [one another:Type.reciprocal,d.grp,f.frml] with respect.;Коллеги обращались друг к другу с уважением.;0;
667;The conference participants introduced [one another:Type.reciprocal,d.grp,f.frml].;Участники конференции представили друг друга.;0;
668;In a civilized society, people must trust [one another:Type.reciprocal,d.grp,f.frml].;В цивилизованном обществе люди должны доверять друг другу.;0;
669;The scholars exchanged research ideas with [one another:Type.reciprocal,d.grp,f.frml].;Ученые обменивались идеями исследований друг с другом.;0;
670;The members of the organization collaborate with [one another:Type.reciprocal,d.grp,f.frml].;Члены организации сотрудничают друг с другом.;0;
671;The diplomats negotiated with [one another:Type.reciprocal,d.grp,f.frml] for hours.;Дипломаты вели переговоры друг с другом часами.;0;
672;The panelists debated [one another:Type.reciprocal,d.grp,f.frml] during the discussion.;Участники панели дискутировали друг с другом во время обсуждения.;0;
673;The delegates greeted [one another:Type.reciprocal,d.grp,f.frml] at the reception.;Делегаты приветствовали друг друга на приеме.;0;
674;The executives shared insights with [one another:Type.reciprocal,d.grp,f.frml].;Руководители обменивались идеями друг с другом.;0;
675;The representatives of different nations learned from [one another:Type.reciprocal,d.grp,f.frml].;Представители разных наций учились друг у друга.;0;
676;You can take [either:Type.determ,c.y,d.1of2,e.positive] seat near the window.;Ты можешь занять любое из двух мест у окна.;0;
677;I don’t think [either:Type.determ,c.y,d.1of2,e.positive] solution is perfect.;Я не думаю, что любое из двух решений идеально.;0;
678;You may choose [either:Type.determ,c.y,d.1of2,e.positive] method for your experiment.;Ты можешь выбрать любой из двух методов для эксперимента.;0;
679;He doesn’t like [either:Type.determ,c.y,d.1of2,e.positive] of the available options.;Ему не нравится ни один из двух доступных вариантов.;0;
680;She bought a dress, but she couldn’t decide on [either:Type.determ,c.y,d.1of2,e.positive] color.;Она купила платье, но не могла выбрать ни один из двух цветов.;0;
681;[Either:Type.determ,c.y,d.1of2,e.positive] answer would be acceptable in this case.;Любой из двух ответов будет приемлем в этом случае.;0;
682;He stood at the crossroads, looking at [either:Type.determ,c.y,d.1of2,e.positive] direction with uncertainty.;Он стоял на перекрестке, смотря в любую из двух сторон с неуверенностью.;0;
683;There was a road on [either:Type.determ,c.y,d.1of2,e.positive] side of the river.;По обе стороны реки была дорога.;0;
684;I don’t think [either:Type.determ,c.y,d.1of2,e.positive] of us wants to lose this opportunity.;Я не думаю, что кто-то из нас двоих хочет упустить эту возможность.;0;
685;You should try [either:Type.determ,c.y,d.1of2,e.positive] key to unlock the door.;Попробуй любой из двух ключей, чтобы открыть дверь.;0;
686;[Each:Type.determ,c.y,d.1ofgrp,e.individuality] student must submit their assignment before Friday.;Каждый студент должен сдать свое задание до пятницы.;0;
687;She gave [each:Type.determ,c.y,d.1ofgrp,e.individuality] of her children a separate gift.;Она подарила каждому из своих детей отдельный подарок.;0;
688;[Each:Type.determ,c.y,d.1ofgrp,e.individuality] participant received a certificate of completion.;Каждый участник получил сертификат о прохождении.;0;
689;The teacher spoke to [each:Type.determ,c.y,d.1ofgrp,e.individuality] student separately.;Учитель поговорил с каждым студентом отдельно.;0;
690;I greeted [each:Type.determ,c.y,d.1ofgrp,e.individuality] guest personally as they arrived.;Я лично приветствовал каждого гостя по прибытии.;0;
691;She placed a flower on [each:Type.determ,c.y,d.1ofgrp,e.individuality] desk before the meeting.;Она положила цветок на каждый стол перед собранием.;0;
692;[Each:Type.determ,c.y,d.1ofgrp,e.individuality] chapter in this book has a summary at the end.;Каждая глава в этой книге имеет резюме в конце.;0;
693;He checked [each:Type.determ,c.y,d.1ofgrp,e.individuality] email carefully before replying.;Он внимательно проверил каждое письмо перед ответом.;0;
694;[Each:Type.determ,c.y,d.1ofgrp,e.individuality] of the candidates will have a chance to speak.;Каждый из кандидатов получит возможность высказаться.;0;
695;I spent time talking to [each:Type.determ,c.y,d.1ofgrp,e.individuality] employee about their concerns.;Я поговорил с каждым сотрудником об их проблемах.;0;
696;[Every:Type.determ,c.y,d.1ofgrp,e.general] morning, she goes for a run in the park.;Каждое утро она бегает в парке.;0;
697;[Every:Type.determ,c.y,d.1ofgrp,e.general] employee must follow the company's guidelines.;Каждый сотрудник должен соблюдать правила компании.;0;
698;He reads a new book [every:Type.determ,c.y,d.1ofgrp,e.general] month.;Он читает новую книгу каждый месяц.;0;
699;I wake up at the same time [every:Type.determ,c.y,d.1ofgrp,e.general] day.;Я просыпаюсь в одно и то же время каждый день.;0;
700;She calls her parents [every:Type.determ,c.y,d.1ofgrp,e.general] Sunday evening.;Она звонит родителям каждое воскресенье вечером.;0;
701;The team meets for a briefing [every:Type.determ,c.y,d.1ofgrp,e.general] Monday morning.;Команда собирается на брифинг каждое утро понедельника.;0;
702;[Every:Type.determ,c.y,d.1ofgrp,e.general] child in the school was given a free book.;Каждому ребенку в школе подарили бесплатную книгу.;0;
703;The system is checked for updates [every:Type.determ,c.y,d.1ofgrp,e.general] week.;Система проверяется на обновления каждую неделю.;0;
704;We clean the house [every:Type.determ,c.y,d.1ofgrp,e.general] Saturday.;Мы убираем дом каждую субботу.;0;
705;[Every:Type.determ,c.y,d.1ofgrp,e.general] seat in the theater was taken.;Каждое место в театре было занято.;0;
706;[Both:Type.determ,c.y,d.2,e.positive] of my friends are coming to the party.;Оба моих друга придут на вечеринку.;0;
707;He is good at [both:Type.determ,c.y,d.2,e.positive] math and science.;Он хорош и в математике, и в науке.;0;
708;She can speak [both:Type.determ,c.y,d.2,e.positive] French and Spanish fluently.;Она свободно говорит и на французском, и на испанском.;0;
709;They [both:Type.determ,c.y,d.2,e.positive] agreed to the terms of the contract.;Они оба согласились с условиями контракта.;0;
710;[Both:Type.determ,c.y,d.2,e.positive] solutions are acceptable in this case.;Оба решения приемлемы в этом случае.;0;
711;We visited [both:Type.determ,c.y,d.2,e.positive] cities during our trip.;Мы посетили оба города во время поездки.;0;
712;He likes [both:Type.determ,c.y,d.2,e.positive] coffee and tea.;Ему нравятся и кофе, и чай.;0;
713;[Both:Type.determ,c.y,d.2,e.positive] of the restaurants have excellent reviews.;Оба ресторана имеют отличные отзывы.;0;
714;The twins look [both:Type.determ,c.y,d.2,e.positive] identical.;Близнецы выглядят совершенно одинаково.;0;
715;You should check [both:Type.determ,c.y,d.2,e.positive] options before deciding.;Тебе следует проверить оба варианта перед принятием решения.;0;
716;[Neither:Type.determ,c.y,d.2,e.negative] of the solutions worked as expected.;Ни одно из двух решений не сработало, как ожидалось.;0;
717;[Neither:Type.determ,c.y,d.2,e.negative] of them wanted to take responsibility.;Ни один из них не хотел брать на себя ответственность.;0;
718;I like [neither:Type.determ,c.y,d.2,e.negative] option that was offered.;Мне не нравится ни один из предложенных вариантов.;0;
719;She can play [neither:Type.determ,c.y,d.2,e.negative] piano nor guitar.;Она не умеет играть ни на пианино, ни на гитаре.;0;
720;[Neither:Type.determ,c.y,d.2,e.negative] of us knew the correct answer.;Ни один из нас двоих не знал правильного ответа.;0;
721;The instructions were unclear, so [neither:Type.determ,c.y,d.2,e.negative] approach worked.;Инструкции были непонятны, поэтому ни один из подходов не сработал.;0;
722;[Neither:Type.determ,c.y,d.2,e.negative] parent agreed with the decision.;Ни один из родителей не согласился с решением.;0;
723;He tried two methods, but [neither:Type.determ,c.y,d.2,e.negative] was effective.;Он попробовал два метода, но ни один не был эффективен.;0;
724;[Neither:Type.determ,c.y,d.2,e.negative] film was interesting enough to watch till the end.;Ни один из фильмов не был достаточно интересен, чтобы досмотреть до конца.;0;
725;We tested both devices, but [neither:Type.determ,c.y,d.2,e.negative] functioned properly.;Мы протестировали оба устройства, но ни одно не работало должным образом.;0;
726;[Several:Type.determ,c.y,d.grpofgrp,e.a-litle-neutral] students raised their hands.;Несколько студентов подняли руки.;0;
727;I visited [several:Type.determ,c.y,d.grpofgrp,e.a-litle-neutral] museums while in Paris.;Я посетил несколько музеев, когда был в Париже.;0;
728;There were [several:Type.determ,c.y,d.grpofgrp,e.a-litle-neutral] reasons for the delay.;Было несколько причин задержки.;0;
729;[Several:Type.determ,c.y,d.grpofgrp,e.a-litle-neutral] attempts were made to fix the issue.;Было предпринято несколько попыток исправить проблему.;0;
730;He has read [several:Type.determ,c.y,d.grpofgrp,e.a-litle-neutral] books on the topic.;Он прочитал несколько книг по этой теме.;0;
731;[Several:Type.determ,c.y,d.grpofgrp,e.a-litle-neutral] people complained about the service.;Несколько человек пожаловались на обслуживание.;0;
732;She has traveled to [several:Type.determ,c.y,d.grpofgrp,e.a-litle-neutral] countries in Europe.;Она путешествовала по нескольким странам Европы.;0;
733;There are [several:Type.determ,c.y,d.grpofgrp,e.a-litle-neutral] options to choose from.;Есть несколько вариантов на выбор.;0;
734;He made [several:Type.determ,c.y,d.grpofgrp,e.a-litle-neutral] mistakes in his calculations.;Он допустил несколько ошибок в расчетах.;0;
735;The company has [several:Type.determ,c.y,d.grpofgrp,e.a-litle-neutral] branches worldwide.;У компании есть несколько филиалов по всему миру.;0;
736;[A few:Type.determ,c.y,d.grpofgrp,e.a-litle-positive] guests arrived early.;Несколько гостей пришли раньше.;0;
737;She has [a few:Type.determ,c.y,d.grpofgrp,e.a-litle-positive] close friends she can rely on.;У нее есть несколько близких друзей, на которых можно положиться.;0;
738;[A few:Type.determ,c.y,d.grpofgrp,e.a-litle-positive] adjustments were needed to perfect the design.;Требовалось несколько корректировок, чтобы улучшить дизайн.;0;
739;We spent [a few:Type.determ,c.y,d.grpofgrp,e.a-litle-positive] hours exploring the city.;Мы провели несколько часов, исследуя город.;0;
740;[A few:Type.determ,c.y,d.grpofgrp,e.a-litle-positive] employees stayed late to finish the project.;Несколько сотрудников остались допоздна, чтобы закончить проект.;0;
741;He took [a few:Type.determ,c.y,d.grpofgrp,e.a-litle-positive] photos during the trip.;Он сделал несколько фотографий во время поездки.;0;
742;[A few:Type.determ,c.y,d.grpofgrp,e.a-litle-positive] days of rest will do you good.;Несколько дней отдыха пойдут тебе на пользу.;0;
743;She made [a few:Type.determ,c.y,d.grpofgrp,e.a-litle-positive] minor changes to the text.;Она внесла несколько небольших изменений в текст.;0;
744;There were [a few:Type.determ,c.y,d.grpofgrp,e.a-litle-positive] empty seats in the theater.;В театре было несколько свободных мест.;0;
745;I have [a few:Type.determ,c.y,d.grpofgrp,e.a-litle-positive] questions about the report.;У меня есть несколько вопросов по отчету.;0;
746;[Few:Type.determ,c.y,d.grpofgrp,e.a-litle-negative] people understood his explanation.;Мало кто понял его объяснение.;0;
747;The event was poorly advertised, so [few:Type.determ,c.y,d.grpofgrp,e.a-litle-negative] attendees showed up.;Мероприятие было плохо разрекламировано, поэтому пришло мало людей.;0;
748;He has [few:Type.determ,c.y,d.grpofgrp,e.a-litle-negative] opportunities to advance in his career.;У него мало возможностей для карьерного роста.;0;
749;[Few:Type.determ,c.y,d.grpofgrp,e.a-litle-negative] companies can afford such expensive technology.;Мало компаний могут позволить себе такую дорогую технологию.;0;
750;She has [few:Type.determ,c.y,d.grpofgrp,e.a-litle-negative] reasons to stay in this job.;У нее мало причин оставаться на этой работе.;0;
751;[Few:Type.determ,c.y,d.grpofgrp,e.a-litle-negative] students passed the difficult exam.;Мало студентов сдали этот сложный экзамен.;0;
752;I have [few:Type.determ,c.y,d.grpofgrp,e.a-litle-negative] doubts about his honesty.;У меня мало сомнений в его честности.;0;
753;[Few:Type.determ,c.y,d.grpofgrp,e.a-litle-negative] restaurants serve authentic local cuisine.;Мало ресторанов подают аутентичную местную кухню.;0;
754;He received [few:Type.determ,c.y,d.grpofgrp,e.a-litle-negative] responses to his job application.;Он получил мало откликов на свое резюме.;0;
755;There are [few:Type.determ,c.y,d.grpofgrp,e.a-litle-negative] ways to solve this problem.;Есть мало способов решить эту проблему.;0;
756;There are [many:Type.determ,c.y,d.grpofgrp,e.a-lot] ways to improve your skills.;Есть много способов улучшить свои навыки.;0;
757;[Many:Type.determ,c.y,d.grpofgrp,e.a-lot] students participated in the competition.;Многие студенты приняли участие в соревновании.;0;
758;She has read [many:Type.determ,c.y,d.grpofgrp,e.a-lot] books on this subject.;Она прочитала много книг по этой теме.;0;
759;[Many:Type.determ,c.y,d.grpofgrp,e.a-lot] tourists visit this city every year.;Много туристов посещают этот город каждый год.;0;
760;There are [many:Type.determ,c.y,d.grpofgrp,e.a-lot] reasons to consider this proposal.;Есть много причин рассмотреть это предложение.;0;
761;[Many:Type.determ,c.y,d.grpofgrp,e.a-lot] of the guests arrived early.;Многие из гостей пришли рано.;0;
762;She has attended [many:Type.determ,c.y,d.grpofgrp,e.a-lot] conferences on the topic.;Она посетила много конференций по этой теме.;0;
763;[Many:Type.determ,c.y,d.grpofgrp,e.a-lot] people believe in the power of positive thinking.;Многие люди верят в силу позитивного мышления.;0;
764;He has [many:Type.determ,c.y,d.grpofgrp,e.a-lot] friends in different countries.;У него много друзей в разных странах.;0;
765;[Many:Type.determ,c.y,d.grpofgrp,e.a-lot] projects require teamwork to be successful.;Многие проекты требуют командной работы для успеха.;0;
766;There isn’t [much:Type.determ,c.n,d.grpofgrp,e.a-lot] time left before the deadline.;До дедлайна осталось не так много времени.;0;
767;She doesn’t have [much:Type.determ,c.n,d.grpofgrp,e.a-lot] experience in this field.;У нее не так много опыта в этой области.;0;
768;[Much:Type.determ,c.n,d.grpofgrp,e.a-lot] effort was needed to complete the task.;Потребовалось много усилий, чтобы завершить задание.;0;
769;He didn’t show [much:Type.determ,c.n,d.grpofgrp,e.a-lot] interest in the topic.;Он не проявил большого интереса к теме.;0;
770;We don’t have [much:Type.determ,c.n,d.grpofgrp,e.a-lot] information about the case.;У нас мало информации по этому делу.;0;
771;[Much:Type.determ,c.n,d.grpofgrp,e.a-lot] work has been done to improve the system.;Было проделано много работы для улучшения системы.;0;
772;She doesn’t drink [much:Type.determ,c.n,d.grpofgrp,e.a-lot] coffee.;Она не пьет много кофе.;0;
